label,tweet_id,tweet,length,#URLs,#mentions,#hashs,verified,#followers,#replies,#retweets,#tweets,#favourites,account_age,user_engagement,sentiment_score
0,544514564407427072,"police seem relaxed, suggesting all hostages are out and gunman no longer a threat URL #sydneysiege",99,1,0,1,1,27756,2,82,101033,32,427,236.88290398126463,-0.34
0,553566026030272512,"breaking: two hostage situations in france are linked, paris prosecutor says",76,0,0,0,1,17764562,8,127,403483,47,2106,191.67378917378917,0.0
0,553506608203169792,"map shows industrial estate where 2 #charliehebdo suspects are holed up, surrounded by police URL URL",101,2,0,1,1,51533881,34,477,38623,182,2819,13.94678964171692,-0.34
0,524959809402331137,senior u.s. official: canadian government has informed u.s. that one shooter is dead in ottawa. live blog: URL,110,1,0,0,1,64119898,34,314,78834,153,2850,27.83684210526316,-0.6486
0,614599815280857088,look: @whitehouse lights up in rainbow colors to celebrate #scotus same-sex marriage ruling URL,95,1,1,1,1,396293,29,607,143281,528,2222,65.00675067506751,0.5719
0,614615157730357248,"watch live: as sun goes down, white house lights up rainbow colors to celebrate scotus ruling URL URL",101,2,0,0,1,4466224,22,145,1083245,135,3019,358.9092414706857,0.5719
0,619242759359037440,"obama 2008:""i support traditional marriage, christians vote for me"" obama 2015:""the white house is a rainbow. bring me my unicorn"" merica.",138,0,0,0,0,1549269,24,1645,22705,4599,1269,22.83136327817179,0.4019
0,552792913910833152,at least 11 dead in shooting at hq of #charliehebdo in #paris (police source) URL,81,1,0,2,1,4079396,4,97,379336,24,2847,133.28451001053742,-0.6486
0,667487418388488192,"the picture of a syrian child ""surrendering"" to a camera is real. URL URL",73,2,0,0,1,294638,19,325,79990,160,2786,28.892318736539842,0.0
0,553586897168392192,#breaking : both charlie hebdo suspects killed as police storm building (police sources) URL URL,96,2,0,1,1,353475,7,353,331851,73,2123,156.51625058878946,-0.7845
0,544399927045283840,"nsw police confirm 5 hostages have emerged from #sydneysiege and they are negotiating: ""it might take a bit of time"" URL",120,1,0,1,1,51533881,26,454,38623,185,2794,14.061560486757337,0.0
0,552792802309181440,#charliehebdo - 11 dead including 2 police in paris shooting. photo @martinbureau1 #afp URL,91,1,1,2,1,199664,5,89,36560,14,821,44.662606577344704,-0.6486
0,614891047886434304,the white house was lit up with rainbow lights to celebrate marriage equality: URL URL,86,2,0,0,1,1720965,5,128,557042,163,2564,217.37051482059283,0.5719
0,525023025792835585,#ripnathancirillo rt @globeandmail: soldier killed at war memorial identified as cpl. nathan cirillo #ottawashooting URL,120,1,1,2,1,51349,9,107,75573,48,2143,35.34157722818479,-0.8555
0,553558982476828674,"on israeli tv, an israeli woman speaks of her nephew,a mother with 6 month old baby, held hostage in the supermarket in paris. #jesuisjuif",138,0,0,1,1,35867,6,87,5977,23,1285,4.741634241245136,0.0
0,544290258951892992,central sydney shut down by police amid ongoing hostage situation: URL,70,1,0,0,1,20394211,8,117,392823,34,2815,139.60284191829484,0.0
0,552802654641225728,charlie hebdo shooting latest: 12 dead and gunmen still at large URL URL,72,2,0,0,1,107778,5,90,163028,17,258,632.3255813953489,-0.6486
0,544305540286148609,a man believed to be the gunman filmed wearing a black headband inside the cafe URL URL,87,2,0,0,1,27756,8,82,101033,10,427,236.8454332552693,0.0
0,524923462398513152,shots fired on parliament hill after a man walked up with a gun. i'm locked in a security office on parliament hill,115,0,0,0,1,19985,12,133,51813,16,1356,38.32890855457227,-0.5574
0,616421546702336000,"woah, nature. URL URL",21,2,0,0,1,9329874,12,149,492355,185,3034,162.39321028345418,0.0
0,524944399890124801,recap: gunman shot dead inside parliament buildings; police believe there may be others on loose. cdn soldier shot earlier at war memorial.,139,0,0,0,1,1533965,8,706,162141,97,2106,77.37511870845204,-0.8885
0,544391176137089024,"hostage taker in sydney cafe demands isis flag and call with australian pm, sky news reports. URL #sydneysiege",110,1,0,1,1,14349332,26,189,283909,24,2823,100.65462274176409,0.0
0,524969201102901248,mps credit sergeant-at-arms for saving lives in parliament hill shootings URL URL,81,2,0,0,1,2274426,18,308,235584,198,2093,112.80840898232202,0.3818
0,552806757672964097,"update: 12 now confirmed dead in #charliehebdo attack in paris, @ap is reporting. story: URL (ap) URL",101,2,1,1,1,4909461,9,221,389345,42,2345,166.14797441364607,-0.8126
0,614593386188828672,white house lit in rainbow colors following us supreme court ruling that same-sex couples have right to marry. URL,114,1,0,0,1,17764562,67,880,403483,1263,2275,178.32659340659342,0.5574
0,650046859537448960,an openly gay man said that he and his partner met with pope francis a day before kim davis did URL,99,1,0,0,1,54785196,28,135,494218,199,3136,157.71045918367346,0.0
0,544269749405097984,breaking: live coverage of hostage situation unfolding in sydney's martin place URL URL,87,2,0,0,1,619651,28,358,293276,64,2361,124.40745446844558,0.0
